{
  "$schema": "https://json-schema.org/draft/2020-12/schema",
  "title": "watch_collections_contract fixture",
  "type": "object",
  "required": ["contract_version", "suite", "case_id", "input", "expected"],
  "properties": {
    "contract_version": {
      "type": "integer",
      "minimum": 1
    },
    "suite": {
      "const": "watch_collections_contract"
    },
    "case_id": {
      "type": "string",
      "minLength": 1
    },
    "input": {
      "type": "object",
      "required": ["payload"],
      "properties": {
        "payload": {
          "type": "object"
        }
      },
      "additionalProperties": false
    },
    "expected": {
      "type": "object",
      "required": ["valid"],
      "properties": {
        "valid": {
          "type": "boolean"
        },
        "normalized": {
          "type": ["object", "null"]
        }
      },
      "additionalProperties": false
    }
  },
  "additionalProperties": false
}
