{
  "contract_version": 1,
  "suite": "watch_collections_contract",
  "case_id": "continue_watching_collection_matches_server_contract",
  "input": {
    "payload": {
      "profileId": "profile-123",
      "kind": "continue-watching",
      "source": "canonical_watch",
      "generatedAt": "2026-04-12T00:00:00Z",
      "items": [
        {
          "id": "cw-1",
          "media": {
            "mediaType": "show",
            "mediaKey": "show:tmdb:1399",
            "title": "Game of Thrones",
            "posterUrl": "https://img/poster.jpg",
            "backdropUrl": "https://img/backdrop.jpg",
            "releaseYear": 2011,
            "rating": 9.2,
            "genre": "Fantasy",
            "seasonNumber": 3,
            "episodeNumber": 9,
            "episodeTitle": "The Rains of Castamere",
            "airDate": "2013-06-02",
            "runtimeMinutes": 55
          },
          "progress": {
            "positionSeconds": 1500,
            "durationSeconds": 3300,
            "progressPercent": 45.45,
            "lastPlayedAt": "2026-04-11T23:58:00Z"
          },
          "lastActivityAt": "2026-04-11T23:58:10Z",
          "origins": [
            "trakt",
            "watch_activity"
          ],
          "dismissible": false
        }
      ],
      "pageInfo": {
        "nextCursor": null,
        "hasMore": false
      }
    }
  },
  "expected": {
    "valid": true,
    "normalized": {
      "profile_id": "profile-123",
      "kind": "continue-watching",
      "source": "canonical_watch",
      "generated_at": "2026-04-12T00:00:00Z",
      "items": [
        {
          "id": "cw-1",
          "media": {
            "media_type": "show",
            "media_key": "show:tmdb:1399",
            "title": "Game of Thrones",
            "poster_url": "https://img/poster.jpg",
            "backdrop_url": "https://img/backdrop.jpg",
            "release_year": 2011,
            "rating": 9.2,
            "genre": "Fantasy",
            "season_number": 3,
            "episode_number": 9,
            "episode_title": "The Rains of Castamere",
            "air_date": "2013-06-02",
            "runtime_minutes": 55
          },
          "progress": {
            "position_seconds": 1500.0,
            "duration_seconds": 3300.0,
            "progress_percent": 45.45,
            "last_played_at": "2026-04-11T23:58:00Z"
          },
          "last_activity_at": "2026-04-11T23:58:10Z",
          "origins": [
            "trakt",
            "watch_activity"
          ],
          "dismissible": false
        }
      ],
      "page_info": {
        "next_cursor": null,
        "has_more": false
      }
    }
  }
}
