{
  "contract_version": 1,
  "suite": "watch_collections_contract",
  "case_id": "history_collection_matches_server_contract",
  "input": {
    "payload": {
      "profileId": "profile-123",
      "kind": "history",
      "source": "canonical_watch",
      "generatedAt": "2026-04-12T00:00:00Z",
      "items": [
        {
          "id": "hist-1",
          "media": {
            "mediaType": "movie",
            "Id": "movie:tmdb:157336",
            "title": "Interstellar",
            "posterUrl": "https://img/interstellar.jpg",
            "releaseYear": 2014,
            "rating": 8.7,
            "genre": "Sci-Fi",
            "subtitle": "2014 \u00b7 169 min",
            "OriginalTitle": null,
            "Overview": null,
            "Taglines": [],
            "ProductionYear": null,
            "PremiereDate": null,
            "CommunityRating": null,
            "OfficialRating": null,
            "Certification": null,
            "Genres": [],
            "RunTimeTicks": null,
            "Status": null,
            "ProviderIds": {
              "Tmdb": null,
              "Imdb": null,
              "Tvdb": null
            },
            "ImageTags": {
              "Primary": null,
              "Backdrop": [],
              "Logo": null,
              "Thumb": null,
              "Screenshot": []
            },
            "ParentImageTags": null,
            "SeriesId": null,
            "SeriesName": null,
            "SeasonId": null,
            "SeasonName": null,
            "ParentIndexNumber": null,
            "IndexNumber": null,
            "AbsoluteIndexNumber": null,
            "EpisodeTitle": null,
            "AirDate": null,
            "RemoteTrailers": [],
            "PosterColor": null,
            "BackdropColor": null,
            "UserData": null
          },
          "watchedAt": "2026-04-10T18:00:00Z",
          "origins": [
            "watch_activity"
          ]
        }
      ],
      "pageInfo": {
        "nextCursor": "cursor-2",
        "hasMore": true
      }
    }
  },
  "expected": {
    "valid": true,
    "normalized": {
      "profile_id": "profile-123",
      "kind": "history",
      "source": "canonical_watch",
      "generated_at": "2026-04-12T00:00:00Z",
      "items": [
        {
          "id": "hist-1",
          "media": {
            "media_type": "movie",
            "media_key": "movie:tmdb:157336",
            "title": "Interstellar",
            "poster_url": "https://img/interstellar.jpg",
            "release_year": 2014,
            "rating": 8.7,
            "genre": "Sci-Fi",
            "subtitle": "2014 \u00b7 169 min"
          },
          "watched_at": "2026-04-10T18:00:00Z",
          "origins": [
            "watch_activity"
          ]
        }
      ],
      "page_info": {
        "next_cursor": "cursor-2",
        "has_more": true
      }
    }
  }
}
