{
  "contract_version": 1,
  "suite": "watch_collections_contract",
  "case_id": "ratings_collection_matches_server_contract",
  "input": {
    "payload": {
      "profileId": "profile-123",
      "kind": "ratings",
      "source": "canonical_watch",
      "generatedAt": "2026-04-12T00:00:00Z",
      "items": [
        {
          "id": "rating-1",
          "media": {
            "mediaType": "movie",
            "Id": "movie:tmdb:27205",
            "title": "Inception",
            "posterUrl": "https://img/inception.jpg",
            "releaseYear": 2010,
            "rating": 8.8,
            "genre": "Sci-Fi",
            "subtitle": "2010 \u00b7 148 min",
            "OriginalTitle": null,
            "Overview": null,
            "Taglines": [],
            "ProductionYear": null,
            "PremiereDate": null,
            "CommunityRating": null,
            "OfficialRating": null,
            "Certification": null,
            "Genres": [],
            "RunTimeTicks": null,
            "Status": null,
            "ProviderIds": {
              "Tmdb": null,
              "Imdb": null,
              "Tvdb": null
            },
            "ImageTags": {
              "Primary": null,
              "Backdrop": [],
              "Logo": null,
              "Thumb": null,
              "Screenshot": []
            },
            "ParentImageTags": null,
            "SeriesId": null,
            "SeriesName": null,
            "SeasonId": null,
            "SeasonName": null,
            "ParentIndexNumber": null,
            "IndexNumber": null,
            "AbsoluteIndexNumber": null,
            "EpisodeTitle": null,
            "AirDate": null,
            "RemoteTrailers": [],
            "PosterColor": null,
            "BackdropColor": null,
            "UserData": null
          },
          "rating": {
            "value": 9,
            "ratedAt": "2026-04-05T20:00:00Z"
          },
          "origins": [
            "ratings"
          ]
        }
      ],
      "pageInfo": {
        "nextCursor": null,
        "hasMore": false
      }
    }
  },
  "expected": {
    "valid": true,
    "normalized": {
      "profile_id": "profile-123",
      "kind": "ratings",
      "source": "canonical_watch",
      "generated_at": "2026-04-12T00:00:00Z",
      "items": [
        {
          "id": "rating-1",
          "media": {
            "media_type": "movie",
            "media_key": "movie:tmdb:27205",
            "title": "Inception",
            "poster_url": "https://img/inception.jpg",
            "release_year": 2010,
            "rating": 8.8,
            "genre": "Sci-Fi",
            "subtitle": "2010 \u00b7 148 min"
          },
          "rating": {
            "value": 9.0,
            "rated_at": "2026-04-05T20:00:00Z"
          },
          "origins": [
            "ratings"
          ]
        }
      ],
      "page_info": {
        "next_cursor": null,
        "has_more": false
      }
    }
  }
}
