{
  "contract_version": 4,
  "suite": "watch_collections_contract",
  "case_id": "continue_watching_query_result_matches_server_contract",
  "input": {
    "payload": {
      "Items": [
        {
          "Id": "a1b2c3d4e5f6a7b8c9d0e1f2a3b4c5d6",
          "Type": "Episode",
          "Name": "Episode Title",
          "OriginalTitle": null,
          "Overview": null,
          "Taglines": [],
          "ProductionYear": null,
          "PremiereDate": null,
          "CommunityRating": null,
          "OfficialRating": null,
          "Certification": null,
          "Genres": [],
          "RunTimeTicks": 27000000000,
          "Status": null,
          "ProviderIds": {
            "Tmdb": null,
            "Imdb": null,
            "Tvdb": null
          },
          "ImageTags": {
            "Primary": null,
            "Backdrop": [
              "https://example.com/backdrop.jpg"
            ],
            "Logo": null,
            "Thumb": null,
            "Screenshot": []
          },
          "ParentImageTags": null,
          "SeriesId": null,
          "SeriesName": null,
          "SeasonId": null,
          "SeasonName": null,
          "ParentIndexNumber": null,
          "IndexNumber": null,
          "AbsoluteIndexNumber": null,
          "EpisodeTitle": null,
          "AirDate": null,
          "RemoteTrailers": [],
          "PosterColor": null,
          "BackdropColor": null,
          "UserData": {
            "ItemId": "a1b2c3d4e5f6a7b8c9d0e1f2a3b4c5d6",
            "IsFavorite": null,
            "Played": false,
            "PlayCount": null,
            "PlaybackPositionTicks": 12000000000,
            "RuntimeTicks": 27000000000,
            "PlayedPercentage": 44.44,
            "LastPlayedDate": "2024-01-15T12:00:00Z",
            "Rating": null,
            "DismissedFromContinueWatching": false
          }
        }
      ],
      "StartIndex": 0,
      "TotalRecordCount": 1,
      "NextCursor": null,
      "HasMore": false
    }
  },
  "expected": {
    "valid": true,
    "normalized": null
  }
}
